{
  "id": "moon_conjunction_mercury",
  "kind": "composite",
  "placementType": "aspect",
  "planet": "moon-mercury",
  "aspect": "conjunction",
  "plainTranslation": "Moon conjunction Mercury: Moon conjunct Mercury, your mind and emotions seem to merge together in this relationships, and you can say what you feel and mean what you say.",
  "policy": "Composite chart entries describe the relationship as a third entity. Read alongside synastry; do not use as a verdict on whether a relationship should continue.",
  "note": "Imported from The Dark Pixie Astrology composites material text.",
  "voiceNeutral": true,
  "status": "REVIEWED"
}
