{
  "id": "moon_virgo",
  "kind": "composite",
  "placementType": "sign",
  "plainTranslation": "Composite Moon in Virgo: feelings show up as care, helpfulness, and attention to needs. At its best, this gives the relationship practical devotion. The pressure point is anxiety and picking at small things instead of naming the feeling.",
  "policy": "Composite chart entries describe the relationship as a third entity. Read alongside synastry; do not use as a verdict on whether a relationship should continue.",
  "note": "Imported from approved project composite chart material. Source file was not copied into the repository.",
  "voiceNeutral": true,
  "status": "REVIEWED",
  "planet": "moon",
  "sign": "virgo"
}
