{
  "id": "moon_mars_conjunction",
  "kind": "composite",
  "placementType": "aspect",
  "plainTranslation": "Emotions and drive fuse, passionate and alive. Gift: honesty and heat. Watch: quick tempers and volatility.",
  "policy": "Composite chart entries describe the relationship as a third entity. Read alongside synastry; do not use as a verdict on whether a relationship should continue.",
  "note": "Imported from approved project composite chart material. Source file was not copied into the repository.",
  "voiceNeutral": true,
  "status": "REVIEWED",
  "planet": "moon-mars",
  "aspect": "conjunction"
}
