{
  "id": "sun_house8",
  "kind": "composite",
  "placementType": "house",
  "plainTranslation": "Composite Sun in the 8th: about intimacy, depth, shared resources, and transformation. At its best, this gives the relationship it changes you both at the core. The pressure point is power struggles and intensity that overwhelms.",
  "policy": "Composite chart entries describe the relationship as a third entity. Read alongside synastry; do not use as a verdict on whether a relationship should continue.",
  "note": "Imported from approved project composite chart material. Source file was not copied into the repository.",
  "voiceNeutral": true,
  "status": "REVIEWED",
  "planet": "sun",
  "house": "8"
}
