{
  "id": "sun_square_jupiter",
  "kind": "composite",
  "placementType": "aspect",
  "planet": "sun-jupiter",
  "aspect": "square",
  "plainTranslation": "This isn't necessarily negative since Jupiter is a happy planet, and you can still get along well and enjoy one another's company.",
  "policy": "Composite chart entries describe the relationship as a third entity. Read alongside synastry; do not use as a verdict on whether a relationship should continue.",
  "voiceNeutral": true,
  "status": "REVIEWED"
}
