{
  "id": "saturn_square_pluto",
  "kind": "composite",
  "placementType": "aspect",
  "planet": "saturn-pluto",
  "aspect": "square",
  "plainTranslation": "It can be difficult for you to stay together when the going gets tough, and you may not feel much of a bond to one another.",
  "policy": "Composite chart entries describe the relationship as a third entity. Read alongside synastry; do not use as a verdict on whether a relationship should continue.",
  "voiceNeutral": true,
  "status": "REVIEWED"
}
