{
  "id": "saturn_pluto_conjunction",
  "kind": "composite",
  "placementType": "aspect",
  "plainTranslation": "Structure and deep change fuse, serious and capable of deep rebuilding. Gift: the power to endure and transform hard things. Watch: heaviness, control, grim intensity.",
  "policy": "Composite chart entries describe the relationship as a third entity. Read alongside synastry; do not use as a verdict on whether a relationship should continue.",
  "note": "Imported from approved project composite chart material. Source file was not copied into the repository.",
  "voiceNeutral": true,
  "status": "REVIEWED",
  "planet": "saturn-pluto",
  "aspect": "conjunction"
}
