{
  "id": "venus_trine_jupiter",
  "kind": "composite",
  "placementType": "aspect",
  "planet": "venus-jupiter",
  "aspect": "trine",
  "plainTranslation": "Venus trine Jupiter: Venus trine Jupiter, you can get along more easily, enjoy being with one another, and are more optimistic together.",
  "policy": "Composite chart entries describe the relationship as a third entity. Read alongside synastry; do not use as a verdict on whether a relationship should continue.",
  "note": "Imported from The Dark Pixie Astrology composites material text.",
  "voiceNeutral": true,
  "status": "REVIEWED"
}
