{
  "id": "mercury_trine_saturn",
  "kind": "composite",
  "placementType": "aspect",
  "planet": "mercury-saturn",
  "aspect": "trine",
  "plainTranslation": "Communication between you can be calm, measured, and focused on what's important without any of the filler.",
  "policy": "Composite chart entries describe the relationship as a third entity. Read alongside synastry; do not use as a verdict on whether a relationship should continue.",
  "voiceNeutral": true,
  "status": "REVIEWED"
}
