{
  "id": "jupiter_trine_saturn",
  "kind": "composite",
  "placementType": "aspect",
  "planet": "jupiter-saturn",
  "aspect": "trine",
  "plainTranslation": "Jupiter trine Saturn: Jupiter sexrile or trine Saturn, finding that balance can be easier between you, and you try to strike the right notes in the relationship.",
  "policy": "Composite chart entries describe the relationship as a third entity. Read alongside synastry; do not use as a verdict on whether a relationship should continue.",
  "note": "Imported from The Dark Pixie Astrology composites material text.",
  "voiceNeutral": true,
  "status": "REVIEWED"
}
