{
  "id": "mars_trine_jupiter",
  "kind": "composite",
  "placementType": "aspect",
  "planet": "mars-jupiter",
  "aspect": "trine",
  "plainTranslation": "Mars trine Jupiter: Mars trine Jupiter, you can help one another to 54/ ​© The Dark Pixie Astrology achieve your goals and have the experiences that you want to have in life.",
  "policy": "Composite chart entries describe the relationship as a third entity. Read alongside synastry; do not use as a verdict on whether a relationship should continue.",
  "note": "Imported from The Dark Pixie Astrology composites material text.",
  "voiceNeutral": true,
  "status": "REVIEWED"
}
